{
	"antiship": {
		"bns_lost_at_sea": 0,
		"crossing_casualties": {},
		"destroyed_by_ship_type": {},
		"mine_status": {},
		"resolved_turn": 0,
		"sent_by_type": {},
		"systems_fired_count": 0,
		"target_beaches": [],
		"target_tos": [],
		"unliftable_bn": 0,
		"wave_bns": 0
	},
	"brigades": [
		{
			"battalions": 3,
			"destroyed": false,
			"fought_this_turn": false,
			"hex_id": "hex_44_17",
			"id": "BDE-21",
			"moved_admin_this_turn": false,
			"moved_this_turn": false,
			"name": "21st Artillery Command",
			"nato_type": "artillery",
			"organization": 100.0,
			"team": "Green"
		},
		{
			"battalions": 5,
			"destroyed": false,
			"fought_this_turn": false,
			"hex_id": "hex_31_8",
			"id": "BDE-234",
			"moved_admin_this_turn": false,
			"moved_this_turn": false,
			"name": "234th Mechanized Infantry Brigade",
			"nato_type": "mech-infantry",
			"organization": 100.0,
			"team": "Green"
		},
		{
			"battalions": 5,
			"destroyed": false,
			"fought_this_turn": false,
			"hex_id": "hex_42_15",
			"id": "BDE-269",
			"moved_admin_this_turn": false,
			"moved_this_turn": false,
			"name": "269th Mechanized Infantry Brigade",
			"nato_type": "mech-infantry",
			"organization": 100.0,
			"team": "Green"
		},
		{
			"battalions": 5,
			"destroyed": false,
			"fought_this_turn": false,
			"hex_id": "hex_11_5",
			"id": "BDE-333",
			"moved_admin_this_turn": false,
			"moved_this_turn": false,
			"name": "333rd Mechanized Infantry Brigade",
			"nato_type": "mech-infantry",
			"organization": 100.0,
			"team": "Green"
		},
		{
			"battalions": 5,
			"destroyed": false,
			"fought_this_turn": false,
			"hex_id": "hex_12_7",
			"id": "BDE-43",
			"moved_admin_this_turn": false,
			"moved_this_turn": false,
			"name": "43rd Artillery Command",
			"nato_type": "artillery",
			"organization": 100.0,
			"team": "Green"
		},
		{
			"battalions": 5,
			"destroyed": false,
			"fought_this_turn": false,
			"hex_id": "hex_40_12",
			"id": "BDE-542",
			"moved_admin_this_turn": false,
			"moved_this_turn": false,
			"name": "542nd Armored Brigade",
			"nato_type": "armor",
			"organization": 100.0,
			"team": "Green"
		},
		{
			"battalions": 5,
			"destroyed": false,
			"fought_this_turn": false,
			"hex_id": "hex_16_3",
			"id": "BDE-564",
			"moved_admin_this_turn": false,
			"moved_this_turn": false,
			"name": "564th Armored Brigade",
			"nato_type": "armor",
			"organization": 100.0,
			"team": "Green"
		},
		{
			"battalions": 5,
			"destroyed": false,
			"fought_this_turn": false,
			"hex_id": "hex_32_8",
			"id": "BDE-58",
			"moved_admin_this_turn": false,
			"moved_this_turn": false,
			"name": "58th Artillery Command",
			"nato_type": "artillery",
			"organization": 100.0,
			"team": "Green"
		},
		{
			"battalions": 5,
			"destroyed": false,
			"fought_this_turn": false,
			"hex_id": "hex_43_14",
			"id": "BDE-584",
			"moved_admin_this_turn": false,
			"moved_this_turn": false,
			"name": "584th Armored Brigade",
			"nato_type": "armor",
			"organization": 100.0,
			"team": "Green"
		},
		{
			"battalions": 5,
			"destroyed": false,
			"fought_this_turn": false,
			"hex_id": "hex_30_7",
			"id": "BDE-586",
			"moved_admin_this_turn": false,
			"moved_this_turn": false,
			"name": "586th Armored Brigade",
			"nato_type": "armor",
			"organization": 100.0,
			"team": "Green"
		},
		{
			"battalions": 3,
			"destroyed": false,
			"fought_this_turn": false,
			"hex_id": "hex_40_14",
			"id": "BDE-601",
			"moved_admin_this_turn": false,
			"moved_this_turn": false,
			"name": "601st Aviation Brigade",
			"nato_type": "aviation",
			"organization": 100.0,
			"team": "Green"
		},
		{
			"battalions": 3,
			"destroyed": false,
			"fought_this_turn": false,
			"hex_id": "hex_32_9",
			"id": "BDE-602",
			"moved_admin_this_turn": false,
			"moved_this_turn": false,
			"name": "602nd Aviation Brigade",
			"nato_type": "aviation",
			"organization": 100.0,
			"team": "Green"
		},
		{
			"battalions": 7,
			"destroyed": false,
			"fought_this_turn": false,
			"hex_id": "hex_43_17",
			"id": "BDE-621",
			"moved_admin_this_turn": false,
			"moved_this_turn": false,
			"name": "621st Artillery Command",
			"nato_type": "artillery",
			"organization": 100.0,
			"team": "Green"
		},
		{
			"battalions": 4,
			"destroyed": false,
			"fought_this_turn": false,
			"hex_id": "hex_12_5",
			"id": "BDE-66",
			"moved_admin_this_turn": false,
			"moved_this_turn": false,
			"name": "66th Marine Brigade",
			"nato_type": "amphibious",
			"organization": 100.0,
			"team": "Green"
		},
		{
			"battalions": 4,
			"destroyed": false,
			"fought_this_turn": false,
			"hex_id": "hex_13_4",
			"id": "BDE-77",
			"moved_admin_this_turn": false,
			"moved_this_turn": false,
			"name": "77th Marine Brigade",
			"nato_type": "amphibious",
			"organization": 100.0,
			"team": "Green"
		},
		{
			"battalions": 5,
			"destroyed": false,
			"fought_this_turn": false,
			"hex_id": "hex_40_15",
			"id": "BDE-862",
			"moved_admin_this_turn": false,
			"moved_this_turn": false,
			"name": "862nd Special Warfare Brigade",
			"nato_type": "special-forces",
			"organization": 100.0,
			"team": "Green"
		},
		{
			"battalions": 3,
			"destroyed": false,
			"fought_this_turn": false,
			"hex_id": "hex_44_20",
			"id": "BDE-911",
			"moved_admin_this_turn": false,
			"moved_this_turn": false,
			"name": "911th Infantry Brigade",
			"nato_type": "reserve",
			"organization": 100.0,
			"team": "Green"
		},
		{
			"battalions": 3,
			"destroyed": false,
			"fought_this_turn": false,
			"hex_id": "hex_42_17",
			"id": "BDE-912",
			"moved_admin_this_turn": false,
			"moved_this_turn": false,
			"name": "912th Infantry Brigade",
			"nato_type": "reserve",
			"organization": 100.0,
			"team": "Green"
		},
		{
			"battalions": 3,
			"destroyed": false,
			"fought_this_turn": false,
			"hex_id": "hex_41_16",
			"id": "BDE-913",
			"moved_admin_this_turn": false,
			"moved_this_turn": false,
			"name": "913th Infantry Brigade",
			"nato_type": "reserve",
			"organization": 100.0,
			"team": "Green"
		},
		{
			"battalions": 3,
			"destroyed": false,
			"fought_this_turn": false,
			"hex_id": "hex_39_11",
			"id": "BDE-914",
			"moved_admin_this_turn": false,
			"moved_this_turn": false,
			"name": "914th Infantry Brigade",
			"nato_type": "reserve",
			"organization": 100.0,
			"team": "Green"
		},
		{
			"battalions": 3,
			"destroyed": false,
			"fought_this_turn": false,
			"hex_id": "hex_31_7",
			"id": "BDE-921",
			"moved_admin_this_turn": false,
			"moved_this_turn": false,
			"name": "921th Infantry Brigade",
			"nato_type": "reserve",
			"organization": 100.0,
			"team": "Green"
		},
		{
			"battalions": 3,
			"destroyed": false,
			"fought_this_turn": false,
			"hex_id": "hex_30_8",
			"id": "BDE-922",
			"moved_admin_this_turn": false,
			"moved_this_turn": false,
			"name": "922th Infantry Brigade",
			"nato_type": "reserve",
			"organization": 100.0,
			"team": "Green"
		},
		{
			"battalions": 3,
			"destroyed": false,
			"fought_this_turn": false,
			"hex_id": "hex_28_9",
			"id": "BDE-923",
			"moved_admin_this_turn": false,
			"moved_this_turn": false,
			"name": "923th Infantry Brigade",
			"nato_type": "reserve",
			"organization": 100.0,
			"team": "Green"
		},
		{
			"battalions": 3,
			"destroyed": false,
			"fought_this_turn": false,
			"hex_id": "hex_25_7",
			"id": "BDE-924",
			"moved_admin_this_turn": false,
			"moved_this_turn": false,
			"name": "924th Infantry Brigade",
			"nato_type": "reserve",
			"organization": 100.0,
			"team": "Green"
		},
		{
			"battalions": 3,
			"destroyed": false,
			"fought_this_turn": false,
			"hex_id": "hex_13_6",
			"id": "BDE-931",
			"moved_admin_this_turn": false,
			"moved_this_turn": false,
			"name": "931th Infantry Brigade",
			"nato_type": "reserve",
			"organization": 100.0,
			"team": "Green"
		},
		{
			"battalions": 3,
			"destroyed": false,
			"fought_this_turn": false,
			"hex_id": "hex_39_19",
			"id": "BDE-941",
			"moved_admin_this_turn": false,
			"moved_this_turn": false,
			"name": "941th Infantry Brigade",
			"nato_type": "reserve",
			"organization": 100.0,
			"team": "Green"
		},
		{
			"battalions": 3,
			"destroyed": false,
			"fought_this_turn": false,
			"hex_id": "hex_29_18",
			"id": "BDE-942",
			"moved_admin_this_turn": false,
			"moved_this_turn": false,
			"name": "942th Infantry Brigade",
			"nato_type": "reserve",
			"organization": 100.0,
			"team": "Green"
		},
		{
			"battalions": 3,
			"destroyed": false,
			"fought_this_turn": false,
			"hex_id": "hex_13_13",
			"id": "BDE-943",
			"moved_admin_this_turn": false,
			"moved_this_turn": false,
			"name": "943th Infantry Brigade",
			"nato_type": "reserve",
			"organization": 100.0,
			"team": "Green"
		},
		{
			"battalions": 4,
			"destroyed": false,
			"fought_this_turn": false,
			"hex_id": "hex_13_5",
			"id": "BDE-99",
			"moved_admin_this_turn": false,
			"moved_this_turn": false,
			"name": "99th Marine Brigade",
			"nato_type": "amphibious",
			"organization": 100.0,
			"team": "Green"
		},
		{
			"battalions": 5,
			"destroyed": false,
			"fought_this_turn": false,
			"hex_id": "hex_44_16",
			"id": "BDE-GDU",
			"moved_admin_this_turn": false,
			"moved_this_turn": false,
			"name": "Guandu Area Command",
			"nato_type": "area-command",
			"organization": 100.0,
			"team": "Green"
		},
		{
			"battalions": 2,
			"destroyed": false,
			"fought_this_turn": false,
			"hex_id": "hex_28_18",
			"id": "BDE-HD",
			"moved_admin_this_turn": false,
			"moved_this_turn": false,
			"name": "Huadong Defense Command",
			"nato_type": "infantry",
			"organization": 100.0,
			"team": "Green"
		},
		{
			"battalions": 3,
			"destroyed": false,
			"fought_this_turn": false,
			"hex_id": "hex_38_20",
			"id": "BDE-LY",
			"moved_admin_this_turn": false,
			"moved_this_turn": false,
			"name": "Lanyang Area Command",
			"nato_type": "area-command",
			"organization": 100.0,
			"team": "Green"
		}
	],
	"field_glossary": {